{
  "$schema": "https://json-schema.org/draft/2020-12/schema",
  "$id": "https://raw.githubusercontent.com/hey-research-lab/hey-ship-action/main/schema/hey-ship.v1.json",
  "title": "hey.ship/v1 ship evidence",
  "description": "Declared evidence written by a GitHub Actions workflow, linking a commit or release to a Robinhood Chain (chain id 4663) deployment. It is a first-party declaration: it does not prove that the contracts belong to the repository's owner, that a deployment is safe, or that HEY will count it as a ship, and it never publishes or verifies a project on HEY. An absent optional field means the workflow did not declare it; it is never zero or empty.",
  "type": "object",
  "additionalProperties": false,
  "required": [
    "schema",
    "declarationState",
    "chainId",
    "repository",
    "repositoryUrl",
    "commit",
    "timestamp",
    "workflowRun",
    "generator"
  ],
  "anyOf": [
    { "required": ["contracts"] },
    { "required": ["deploymentTx"] },
    { "required": ["release"] }
  ],
  "properties": {
    "schema": {
      "const": "hey.ship/v1",
      "description": "Document format and major version."
    },
    "declarationState": {
      "const": "DECLARED",
      "description": "Always DECLARED: a first-party statement, never a verification."
    },
    "chainId": {
      "const": 4663,
      "description": "Robinhood Chain. No other chain is supported."
    },
    "repository": {
      "type": "string",
      "pattern": "^[A-Za-z0-9][A-Za-z0-9-]{0,38}/[A-Za-z0-9._-]{1,100}$",
      "description": "owner/name of the repository the workflow ran in (GITHUB_REPOSITORY)."
    },
    "repositoryUrl": {
      "type": "string",
      "maxLength": 600,
      "pattern": "^https://[^\\s/?#@]+(?:/[^\\s?#]*)?$",
      "description": "The repository on its GitHub server (GITHUB_SERVER_URL + repository)."
    },
    "commit": {
      "type": "string",
      "pattern": "^(?:[0-9a-f]{40}|[0-9a-f]{64})$",
      "description": "The commit the workflow ran on (GITHUB_SHA), lowercase. On pull_request events this is a merge commit."
    },
    "ref": {
      "type": "string",
      "pattern": "^refs/[^\\s~^:?*\\[\\\\\\u0000-\\u001f\\u007f]{1,500}$",
      "description": "GITHUB_REF, when the runner set it."
    },
    "refName": {
      "type": "string",
      "pattern": "^[^\\s~^:?*\\[\\\\\\u0000-\\u001f\\u007f]{1,255}$",
      "description": "GITHUB_REF_NAME, when the runner set it."
    },
    "refType": {
      "enum": ["branch", "tag"],
      "description": "GITHUB_REF_TYPE, when the runner set it."
    },
    "release": {
      "type": "string",
      "pattern": "^[A-Za-z0-9][A-Za-z0-9._+/-]{0,127}$",
      "not": {
        "anyOf": [
          {
            "pattern": "^(?:[Ll][Aa][Tt][Ee][Ss][Tt].*|[Nn][Ii][Gg][Hh][Tt][Ll][Yy].*|.*-[Dd][Ee][Bb][Uu][Gg]|[Ee][Dd][Gg][Ee]|[Cc][Aa][Nn][Aa][Rr][Yy]|[Dd][Ee][Vv]|[Ss][Nn][Aa][Pp][Ss][Hh][Oo][Tt])$"
          },
          { "pattern": "\\.\\.|//|/$|\\.$|\\.[Ll][Oo][Cc][Kk]$" }
        ]
      },
      "description": "The release the workflow declared, as given. Rolling tags (latest*, nightly*, *-debug, edge, canary, dev, snapshot) are never a release."
    },
    "timestamp": {
      "type": "string",
      "pattern": "^\\d{4}-\\d{2}-\\d{2}T\\d{2}:\\d{2}:\\d{2}(?:\\.\\d{3})?Z$",
      "description": "When the action wrote the file (UTC, runner clock). Not the deployment time."
    },
    "workflowRun": {
      "type": "object",
      "additionalProperties": false,
      "required": ["id", "attempt", "url", "event"],
      "properties": {
        "id": { "type": "string", "pattern": "^[1-9][0-9]{0,19}$" },
        "attempt": { "type": "integer", "minimum": 1 },
        "url": {
          "type": "string",
          "maxLength": 600,
          "pattern": "^https://[^\\s/?#@]+(?:/[^\\s?#]*)?$"
        },
        "event": { "type": "string", "pattern": "^[a-z_]{1,64}$" },
        "workflowRef": {
          "type": "string",
          "maxLength": 600,
          "pattern": "^[A-Za-z0-9][A-Za-z0-9-]{0,38}/[A-Za-z0-9._-]{1,100}/[^\\s~^:?*\\[\\\\\\u0000-\\u001f\\u007f]{1,300}@refs/[^\\s~^:?*\\[\\\\\\u0000-\\u001f\\u007f]{1,255}$"
        },
        "workflowSha": { "type": "string", "pattern": "^(?:[0-9a-f]{40}|[0-9a-f]{64})$" }
      },
      "description": "The run that wrote the file (GITHUB_RUN_ID, GITHUB_RUN_ATTEMPT, GITHUB_EVENT_NAME, GITHUB_WORKFLOW_REF, GITHUB_WORKFLOW_SHA)."
    },
    "contracts": {
      "type": "array",
      "minItems": 1,
      "maxItems": 100,
      "uniqueItems": true,
      "items": {
        "type": "string",
        "pattern": "^0x[0-9a-f]{40}$",
        "not": {
          "enum": [
            "0x0000000000000000000000000000000000000000",
            "0x000000000000000000000000000000000000dead"
          ]
        }
      },
      "description": "Contract addresses the workflow declares it deployed, lowercase. A declaration, not ownership."
    },
    "deploymentTx": {
      "type": "string",
      "pattern": "^0x[0-9a-f]{64}$",
      "description": "The deployment transaction hash the workflow declares, lowercase."
    },
    "artifactHashes": {
      "type": "array",
      "minItems": 1,
      "maxItems": 256,
      "items": {
        "type": "object",
        "additionalProperties": false,
        "required": ["path", "sha256", "bytes"],
        "properties": {
          "path": { "$ref": "#/$defs/relativePath" },
          "sha256": { "type": "string", "pattern": "^[0-9a-f]{64}$" },
          "bytes": { "type": "integer", "minimum": 0 }
        }
      },
      "description": "sha256 of files in the workspace at the time of writing. Paths are unique (checked by the generator)."
    },
    "manifest": {
      "type": "object",
      "additionalProperties": false,
      "required": ["path", "sha256", "version", "chainId"],
      "properties": {
        "path": { "$ref": "#/$defs/relativePath" },
        "sha256": { "type": "string", "pattern": "^[0-9a-f]{64}$" },
        "version": { "const": 1 },
        "chainId": { "const": 4663 }
      },
      "description": "The repository's hey-project.json declaration, by path and sha256 of its exact bytes."
    },
    "generator": {
      "type": "object",
      "additionalProperties": false,
      "required": ["name", "version"],
      "properties": {
        "name": { "const": "hey-ship-action" },
        "version": { "type": "string", "pattern": "^\\d+\\.\\d+\\.\\d+(?:-[0-9A-Za-z.-]+)?$" }
      }
    }
  },
  "$defs": {
    "relativePath": {
      "type": "string",
      "maxLength": 1024,
      "pattern": "^[^/\\\\\\u0000-\\u001f\\u007f][^\\\\\\u0000-\\u001f\\u007f]{0,1023}$",
      "not": { "pattern": "(?:^|/)\\.{1,2}(?:/|$)|//|/$" }
    }
  }
}
