{
  "schema": "hey.ship/v1",
  "declarationState": "DECLARED",
  "chainId": 4663,
  "repository": "example-org/example-app",
  "repositoryUrl": "https://github.com/example-org/example-app",
  "commit": "89abcdef0123456789abcdef0123456789abcdef",
  "release": "v0.4.1",
  "timestamp": "2026-10-02T12:00:00Z",
  "workflowRun": {
    "id": "42",
    "attempt": 2,
    "url": "https://github.com/example-org/example-app/actions/runs/42/attempts/2",
    "event": "release"
  },
  "generator": { "name": "hey-ship-action", "version": "0.1.0" }
}
